{
  "$schema": "../../schemas/project-spec-v1.schema.json",
  "schema_version": "1.0",
  "project": {
    "id": "flange_plate_v110_coupon_example",
    "name": "Flange Plate 1.1 Rectangular-Opening Coupon Example",
    "version": "v01",
    "intent": "original"
  },
  "generator": {
    "id": "flange_plate",
    "version": "1.1.0",
    "parameters": {
      "outer_width": 100,
      "outer_height": 80,
      "plate_thickness": 5,
      "center_opening": {"type": "rectangle", "width": 50, "height": 35},
      "corner_radius": 8,
      "mounting_hole_pattern": {"type": "rectangular", "x_spacing": 80, "y_spacing": 60},
      "mounting_hole_diameter": 4.5,
      "center_opening_fit": "slip",
      "mounting_hole_fit": "nominal",
      "hole_finish": {"type": "none"}
    }
  },
  "input_units": "mm",
  "printer_profile": "generic_fdm",
  "material": "PLA",
  "nozzle_diameter": 0.4,
  "fit_profile": "neutral_unverified_starter",
  "generation_mode": "fit_coupon",
  "fit_coupon": {
    "interface_parameter": "center_opening.width",
    "candidate_offsets": [-0.2, 0, 0.2],
    "notes": "Synthetic width offsets only; numbered labels map to exact width/height pairs in the manifest."
  },
  "fit_coupon_evidence": null,
  "measurement_contract": [],
  "verification_policy": {
    "require_authoritative_protected_interfaces": true,
    "require_proven_calibration_for_full_part": false,
    "mesh_bounds_tolerance_mm": 0.05,
    "physical_fit_required_for_verified_claim": true
  },
  "workflow_state": "draft",
  "physical_verification": {
    "status": "not_confirmed",
    "confirmed_at": null,
    "confirmed_by": null,
    "evidence": [],
    "notes": "No coupon has been printed or tested."
  },
  "timestamps": {
    "created_at": "2026-08-10T00:00:00Z",
    "updated_at": "2026-08-10T00:00:00Z"
  },
  "generated_artifacts": [],
  "warnings": [
    "The neutral calibration profile and candidate offsets are unverified starters."
  ],
  "unresolved_assumptions": [
    "All dimensions and candidate offsets are illustrative synthetic values."
  ]
}
